{
  "colors": {
    "primary": "#2f6fed",
    "ink": "#161821",
    "sub": "#6b7280",
    "background": "#FFFFFF",
    "surface": "#f4f5f7",
    "card": "#f4f5f7",
    "pill": "#eef0f3",
    "pillShadowLight": "rgba(255,255,255,0.9)",
    "pillShadowDark": "rgba(163,168,178,0.45)",
    "border": "rgba(163,168,178,0.3)"
  },
  "radius": {
    "card": "44px",
    "pill": "26px",
    "badge": "20px",
    "social": "16px",
    "avatar": "50%",
    "icon": "14px",
    "button": "26px"
  },
  "shadows": {
    "card": "0 30px 60px rgba(120,124,134,0.28), 0 2px 6px rgba(120,124,134,0.15), inset 0 1px 0 rgba(255,255,255,0.6)",
    "pill": "6px 6px 12px rgba(163,168,178,0.45), -6px -6px 12px rgba(255,255,255,0.9)",
    "badge": "0 4px 10px rgba(120,124,134,0.18)",
    "avatar": "0 10px 24px rgba(120,124,134,0.25)",
    "linkIcon": "0 3px 8px rgba(120,124,134,0.18)"
  },
  "spacing": {
    "stagePadding": "24px 16px",
    "cardPadding": "16px 16px 20px",
    "avatarMargin": "18px 0",
    "socialsMargin": "24px 0 26px",
    "linksGap": "14px",
    "socialsGap": "14px"
  },
  "typography": {
    "fontFamily": "-apple-system, BlinkMacSystemFont, \"SF Pro Display\", \"Segoe UI\", Roboto, Helvetica, Arial, sans-serif",
    "headingFont": "-apple-system, BlinkMacSystemFont, \"SF Pro Display\", \"Segoe UI\", Roboto, Helvetica, Arial, sans-serif",
    "bodyFont": "-apple-system, BlinkMacSystemFont, \"SF Pro Display\", \"Segoe UI\", Roboto, Helvetica, Arial, sans-serif",
    "nameSize": "30px",
    "nameWeight": "800",
    "taglineSize": "16.5px",
    "taglineWeight": "500",
    "linkTitleSize": "17px",
    "linkTitleWeight": "700",
    "linkSubSize": "14px"
  }
}
